{"schema":"asb.protoAi/2","_note":"Illustrative sample AI notes, written during prototyping to show where AI context appears. They are not output of the production pipeline and have not been theologically reviewed. Keys are fromVid>toStart or fromVid>toStart-toEnd.","edges":{"43003016>45005008":"Both verses ground God's love in an act, not a feeling: John says God gave His Son; Paul says Christ died for us while we were still sinners.","43003016>62004009-62004010":"John's letter restates his Gospel line almost word for word: God sent His one and only Son into the world, and this is what love is.","43003016>43003015":"The verse immediately before it: 'everyone who believes in Him may have eternal life' is the promise 3:16 then explains with God's love as its cause.","1001001>43001001-43001003":"John opens his Gospel with the same words, 'In the beginning', and names the Word as the one through whom all things were made.","1001001>58011003":"Hebrews reads the creation account as a lesson in faith: the universe was formed at God's command, out of what cannot be seen.","1001001>23045018":"Isaiah points to creation as proof that God is unique: the one who made the heavens and formed the earth is the only God.","19022001>40027046":"Jesus quotes this opening line from the cross. Matthew gives it in Aramaic, 'Eli, Eli, lema sabachthani', and then translates it.","19022001>41015034":"Mark records the same cry from the cross in its Aramaic form, 'Eloi, Eloi', with a translation that matches this verse.","19022001>19022016":"The same psalm moves from the cry of abandonment to a scene of being surrounded, with hands and feet pierced. Christians have long read it alongside the crucifixion.","23053005>60002024-60002025":"Peter borrows Isaiah's words directly, 'by His stripes you are healed', and then picks up the image of straying sheep from the next verse of Isaiah.","23053005>60003018":"Peter states the exchange Isaiah describes in plain terms: the righteous suffered for the unrighteous, to bring us to God.","23053005>40020028":"Jesus describes His own mission in the language of a substitute: He came to give His life as a ransom for many.","45005008>43003016":"The two best-known statements of God's love side by side: Paul's proof in Christ's death matches Jesus' words about God giving His Son.","45005008>45005006":"Two verses earlier Paul makes the same point from another angle: Christ died for the ungodly while we were still powerless.","45005008>43015013":"Jesus calls laying down one's life for friends the greatest love. Paul goes further here: Christ died for people who were still sinners.","43001001>1001001":"John deliberately echoes the first words of Genesis, placing the Word at the beginning, before creation and behind it.","43001001>62001001-62001002":"John's first letter opens the same way, 'from the beginning', but stresses that this eternal Word was seen, heard and touched.","43001001>43017005":"Jesus Himself speaks of the glory He shared with the Father before the world existed, the same claim John makes in his opening line.","40005003>23066002":"God says He looks with favor on the one who is humble and contrite in spirit, the same people Jesus calls blessed.","40005003>20029023":"Proverbs makes the same reversal: pride brings a person low, while a humble spirit obtains honor.","40005003>23061001":"Isaiah's anointed messenger brings good news to the poor. Jesus reads this passage aloud in Luke 4 and claims it for Himself.","19023001>50004019":"Paul's promise that God will supply every need restates the psalm's confidence: with this shepherd, 'I shall not want'.","19023001>43010011":"Jesus takes the psalm's title for Himself, 'I am the good shepherd', and adds that this shepherd lays down His life for the sheep.","19023001>23040011":"Isaiah paints the same picture of God as a shepherd who tends the flock and carries the lambs close to His heart.","58011001>47004018":"Paul describes faith the same way: fixing our eyes on what is unseen and eternal rather than on what is seen and temporary.","58011001>47005007":"A one-line summary of the same idea: we walk by faith, not by sight.","58011001>45008024-45008025":"Paul ties hope to the unseen just as Hebrews does: hope that is seen is no hope at all, so we wait for it patiently.","23007014>40001023":"Matthew quotes this verse to explain Jesus' birth and translates the name: Immanuel means 'God with us'.","23007014>23009006":"Two chapters later Isaiah returns to the promised child, 'unto us a child is born', with titles such as Mighty God and Prince of Peace.","23007014>42001031":"The angel's announcement to Mary follows the same pattern: you will conceive and give birth to a son.","43014006>43010009":"Another of Jesus' 'I am' sayings with the same claim: He is the gate, and whoever enters through Him will be saved.","43014006>44004012":"Peter makes the same exclusive claim in public in Jerusalem: salvation is found in no other name.","43014006>49002018":"Paul explains what 'the way to the Father' means in practice: through Christ, Jew and Gentile both have access by one Spirit.","49002008>49002005":"Paul says it first three verses earlier, in the middle of a sentence: 'It is by grace you have been saved'.","49002008>45003022-45003026":"Romans lays out the full argument behind this verse: righteousness from God comes through faith, freely by His grace, to all who believe.","49002008>45004016":"Paul links faith and grace the same way in Romans: the promise comes by faith so that it rests on grace."},"verses":{"43003016":{"summary":"Jesus tells Nicodemus that God's love for the world is the reason He gave His one and only Son, and that trusting the Son is what separates perishing from eternal life.","context":"Spoken at night to Nicodemus, a Pharisee (John 3:1-2). It follows the bronze-snake comparison in 3:14-15 (Numbers 21:8-9): as Israel lived by looking at the lifted-up snake, people live by believing in the lifted-up Son.","speaker":"Jesus (to Nicodemus)","themes":["love of God","eternal life","belief","the Son given","the world"],"readingTip":"Read 3:14-18 as one unit: 'lifted up', 'gave', and 'not condemned' explain each other.","questions":["What does 'the world' include here, given 3:17?","How do verses 14-15 set up 'gave' in verse 16?"]}}}