{
 "schema": "asb.protoAi/2",
 "_note": "Illustrative sample AI notes, written during prototyping to show where AI context appears. They are not output of the production pipeline and have not been theologically reviewed. Keys are fromVid>toStart or fromVid>toStart-toEnd.",
 "edges": {
  "43003016>45005008": "Both verses ground God's love in an act, not a feeling: John says God gave His Son; Paul says Christ died for us while we were still sinners.",
  "43003016>62004009-62004010": "John's letter restates his Gospel line almost word for word: God sent His one and only Son into the world, and this is what love is.",
  "43003016>43003015": "The verse immediately before it: 'everyone who believes in Him may have eternal life' is the promise 3:16 then explains with God's love as its cause."
 },
 "verses": {
  "43003016": {
   "summary": "Jesus tells Nicodemus that God's love for the world is the reason He gave His one and only Son, and that trusting the Son is what separates perishing from eternal life.",
   "context": "Spoken at night to Nicodemus, a Pharisee (John 3:1-2). It follows the bronze-snake comparison in 3:14-15 (Numbers 21:8-9): as Israel lived by looking at the lifted-up snake, people live by believing in the lifted-up Son.",
   "speaker": "Jesus (to Nicodemus)",
   "themes": [
    "love of God",
    "eternal life",
    "belief",
    "the Son given",
    "the world"
   ],
   "readingTip": "Read 3:14-18 as one unit: 'lifted up', 'gave', and 'not condemned' explain each other.",
   "questions": [
    "What does 'the world' include here, given 3:17?",
    "How do verses 14-15 set up 'gave' in verse 16?"
   ]
  }
 }
}